sentence_id	text	translation	lemma	translation_token	translation_lemma	alignment
d003.s014	Russian companies Lukoil and Gazprom were the top stakeholders in two of the contracts awarded this weekend .	在本周末授予的两份合同中，俄罗斯公司卢克石油公司和俄罗斯天然气工业股份公司是最大的利益相关者。	russian company lukoil and gazprom be the top stakeholder in two of the contract award this weekend .	在 本周末 授予 的 两 份 合同 中 ， 俄罗斯 公司 卢克 石油 公司 和 俄罗斯 天然气 工业 股份 公司 是 最 大 的 利益 相关者 。	在 本周末 授予 的 两 份 合同 中 ， 俄罗斯 公司 卢克 石油 公司 和 俄罗斯 天然气 工业 股份 公司 是 最 大 的 利益 相关者 。	[(1, 10), (2, 12), (3, 14), (4, 11), (5, 20), (8, 24), (9, 7), (10, 4), (11, 23), (13, 6), (14, 2), (16, 1), (17, 26)]
d003.s015	State-owned China National Petroleum Corporation bid on more contracts than any other company and walked away with large stakes in contracts for two major fields .	国有的中国石油天然气集团公司竞标的合同数量超过任何其他公司，并带走了两大领域的大量合同。	state-owned china national petroleum corporation bid on more contract than any other company and walk away with large stake in contract for two major field .	国有 的 中国 石油 天然气 集团 公司 竞标 的 合同 数量 超过 任何 其他 公司 ， 并 带走 了 两 大 领域 的 大量 合同 。	国有 的 中国 石油 天然气 集团 公司 竞标 的 合同 数量 超过 任何 其他 公司 ， 并 带走 了 两 大 领域 的 大量 合同 。	[(0, 0), (1, 2), (3, 3), (4, 6), (5, 7), (8, 9), (9, 11), (10, 12), (11, 13), (12, 14), (13, 16), (14, 17), (15, 17), (16, 1), (17, 23), (19, 18), (20, 24), (22, 19), (23, 20), (24, 21), (25, 25)]
d003.s016	We all know that China is on track to become a major economic as well as technological power , Oil Ministry spokesman Assam Jihad said .	石油部发言人阿萨姆圣战表示，我们都知道中国有望成为一个主要的经济和技术强国。	we all know that china be on track to become a major economic as well as technological power , oil ministry spokesman assam jihad say .	石油部 发言人 阿萨姆 圣战 表示 ， 我们 都 知道 中国 有望 成为 一个 主要 的 经济 和 技术 强国 。	石油部 发言人 阿萨姆 圣战 表示 ， 我们 都 知道 中国 有望 成为 一个 主要 的 经济 和 技术 强国 。	[(0, 6), (1, 7), (4, 9), (8, 8), (9, 11), (10, 12), (11, 13), (12, 15), (17, 18), (19, 0), (20, 0), (21, 1), (22, 2), (23, 3), (24, 4), (25, 19)]
d003.s017	We feel confident that the Chinese company will be on par with its competitors and will deliver on its commitments towards Iraq .	我们相信，这家中国公司将与竞争对手并驾齐驱，兑现对伊拉克的承诺。	we feel confident that the chinese company will be on par with its competitor and will deliver on its commitment towards iraq .	我们 相信 ， 这家 中国 公司 将 与 竞争 对手 并驾齐驱 ， 兑现 对 伊拉克 的 承诺 。	我们 相信 ， 这家 中国 公司 将 与 竞争 对手 并驾齐驱 ， 兑现 对 伊拉克 的 承诺 。	[(0, 0), (2, 1), (4, 3), (6, 5), (7, 6), (9, 10), (13, 9), (14, 7), (16, 12), (19, 16), (20, 13), (21, 14), (22, 17)]
d003.s018	Companies pre-selected to submit bids made offers that were then compared to the per barrel fee the ministry was willing to pay for boosting output above current levels at each field .	预先选定提交出价的公司，然后将其与该部愿意为将每个油田的产量提高到当前水平而支付的每桶费用进行比较。	company pre-selected to submit bid make offer that be then compare to the per barrel fee the ministry be willing to pay for boost output above current level at each field .	预先 选定 提交 出价 的 公司 ， 然后 将 其 与 该部 愿意 为 将 每个 油田 的 产量 提高 到 当前 水平 而 支付 的 每 桶 费用 进行 比较 。	预先 选定 提交 出价 的 公司 ， 然后 将 其 与 该部 愿意 为 将 每个 油田 的 产量 提高 到 当前 水平 而 支付 的 每 桶 费用 进行 比较 。	[(0, 5), (1, 1), (2, 2), (5, 3), (6, 3), (7, 9), (9, 7), (11, 10), (12, 17), (13, 26), (14, 27), (15, 28), (16, 21), (17, 11), (18, 8), (19, 12), (20, 20), (21, 24), (22, 13), (23, 19), (24, 18), (27, 22), (29, 15), (30, 16), (31, 31)]
d004.s000	US banks repay state support	美国银行偿还国家支持	us bank repay state support	美国 银行 偿还 国家 支持	美国 银行 偿还 国家 支持	[(0, 0), (1, 1), (2, 2), (3, 3), (4, 4)]
d004.s001	The crisis-hit US major banks are breaking free from their state shackles .	受危机影响的美国主要银行正在摆脱国家的束缚。	the crisis-hit us major bank be break free from they state shackle .	受 危机 影响 的 美国 主要 银行 正在 摆脱 国家 的 束缚 。	受 危机 影响 的 美国 主要 银行 正在 摆脱 国家 的 束缚 。	[(0, 0), (1, 1), (2, 4), (3, 5), (4, 6), (7, 8), (10, 9), (12, 12)]
d004.s002	On Wednesday Bank of America repaid the support from the bank protection fund TARP in the amount USD 45 billion ( nearly EUR 30 billion ) in one go .	周三，美国银行一次性偿还了银行保护基金TARP的支持，金额为450亿美元（近300亿欧元）。	on wednesday bank of america repay the support from the bank protection fund tarp in the amount usd 45 billion ( nearly eur 30 billion ) in one go .	周三 ， 美国 银行 一 次 性偿 还 了 银行 保护 基金 TARP 的 支持 ， 金额 为 450亿 美元 （ 近 300亿 欧元 ） 。	周三 ， 美国 银行 一 次 性偿 还 了 银行 保护 基金 TARP 的 支持 ， 金额 为 450亿 美元 （ 近 300亿 欧元 ） 。	[(1, 0), (2, 3), (3, 13), (4, 2), (5, 6), (6, 5), (7, 14), (10, 9), (11, 10), (12, 11), (13, 12), (16, 16), (18, 18), (19, 18), (21, 21), (23, 22), (24, 22), (27, 4), (29, 25)]
d004.s003	And , according to reports from US broadcaster CNBC , Citigroup is also planning to repay the state support .	而且，根据美国广播公司CNBC的报道，花旗集团还计划偿还国家支持。	and , accord to report from us broadcaster cnbc , citigroup be also plan to repay the state support .	而且 ， 根据 美国 广播 公司 CNBC 的 报道 ， 花旗 集团 还 计划 偿还 国家 支持 。	而且 ， 根据 美国 广播 公司 CNBC 的 报道 ， 花旗 集团 还 计划 偿还 国家 支持 。	[(3, 4), (4, 8), (6, 3), (7, 5), (8, 6), (10, 11), (12, 12), (13, 13), (14, 14), (16, 10), (17, 15), (18, 16), (19, 17)]
d004.s004	The institutions thereby want to wiggle themselves free from the restrictions going hand-in-hand with the acceptance of the money , such as the limits on manager bonuses and the paying of high charges .	因此，这些机构希望摆脱与接受资金齐头并进的限制，例如对经理奖金的限制和支付高额费用。	the institution thereby want to wiggle themselves free from the restriction go hand-in-hand with the acceptance of the money , such as the limit on manager bonus and the pay of high charge .	因此 ， 这些 机构 希望 摆脱 与 接受 资金 齐头并进 的 限制 ， 例如 对 经理 奖金 的 限制 和 支付 高额 费用 。	因此 ， 这些 机构 希望 摆脱 与 接受 资金 齐头并进 的 限制 ， 例如 对 经理 奖金 的 限制 和 支付 高额 费用 。	[(0, 2), (1, 3), (4, 4), (8, 5), (9, 6), (10, 11), (13, 6), (15, 7), (16, 10), (17, 8), (18, 8), (20, 13), (21, 0), (22, 14), (23, 18), (24, 14), (25, 15), (26, 16), (27, 19), (29, 20), (30, 17), (31, 21), (32, 22), (33, 23)]
d004.s005	Bank of America had raised some USD 19 billion from investors through convertible loans .	美国银行通过可转换贷款从投资者那里筹集了大约190亿美元。	bank of america have raise some usd 19 billion from investor through convertible loan .	美国 银行 通过 可转换 贷款 从 投资者 那里 筹集 了 大约 190亿 美元 。	美国 银行 通过 可转换 贷款 从 投资者 那里 筹集 了 大约 190亿 美元 。	[(0, 1), (2, 0), (4, 8), (7, 11), (8, 11), (9, 5), (10, 6), (11, 2), (12, 3), (13, 4), (14, 13)]
d004.s006	The rest of the amount was taken from its own kitty , which was well filled through the sale of business units .	其余的金额来自自己的小猫，通过出售业务部门得到了很好的填充。	the rest of the amount be take from its own kitty , which be well fill through the sale of business unit .	其余 的 金额 来自 自己 的 小 猫 ， 通过 出售 业务 部门 得到 了 很 好的 填充 。	其余 的 金额 来自 自己 的 小 猫 ， 通过 出售 业务 部门 得到 了 很 好的 填充 。	[(0, 0), (2, 1), (4, 2), (6, 13), (7, 3), (10, 7), (15, 17), (16, 9), (18, 10), (19, 5), (20, 11), (21, 12), (22, 18)]
d004.s007	Bank head Kenneth Lewis extended his express thanks to the American taxpayer on Wednesday evening : The cash injection helped over a very difficult time .	银行负责人肯尼斯·刘易斯（ Kenneth Lewis ）周三晚上向美国纳税人表示感谢：现金注入帮助度过了一段非常困难的时期。	bank head kenneth lewi extend he express thanks to the american taxpayer on wednesday evening : the cash injection help over a very difficult time .	银行 负责人 肯尼斯·刘易斯 （ Kenneth Lewis ） 周三 晚上 向 美国 纳税人 表示 感谢 ： 现金 注入 帮助 度过 了 一 段 非常 困难 的 时期 。	银行 负责人 肯尼斯·刘易斯 （ Kenneth Lewis ） 周三 晚上 向 美国 纳税人 表示 感谢 ： 现金 注入 帮助 度过 了 一 段 非常 困难 的 时期 。	[(0, 0), (1, 1), (2, 2), (3, 5), (6, 12), (7, 13), (8, 9), (11, 11), (13, 7), (14, 8), (17, 15), (18, 16), (19, 17), (21, 20), (22, 22), (23, 23), (24, 25), (25, 26)]
d004.s008	The bank overstretched at the height of the financial crisis by taking over the investment bank Merrill Lynch .	在金融危机最严重的时候，这家银行通过接管投资银行美林(Merrill Lynch)而捉襟见肘。	the bank overstretch at the height of the financial crisis by take over the investment bank merrill lynch .	在 金融 危机 最 严重 的 时候 ， 这家 银行 通过 接管 投资 银行 美林( Merrill Lynch) 而 捉襟见肘 。	在 金融 危机 最 严重 的 时候 ， 这家 银行 通过 接管 投资 银行 美林( Merrill Lynch) 而 捉襟见肘 。	[(0, 8), (1, 9), (4, 0), (5, 4), (6, 5), (8, 1), (9, 2), (10, 10), (11, 11), (12, 11), (13, 8), (14, 12), (15, 13), (16, 15), (17, 16), (18, 19)]
d004.s009	Citigroup also plans to raise cash on the capital market to free itself from its liabilities with the state .	花旗集团还计划在资本市场上筹集现金，以摆脱对国家的负债。	citigroup also plan to raise cash on the capital market to free itself from its liability with the state .	花旗 集团 还 计划 在 资本 市场 上 筹集 现金 ， 以 摆脱 对 国家 的 负债 。	花旗 集团 还 计划 在 资本 市场 上 筹集 现金 ， 以 摆脱 对 国家 的 负债 。	[(0, 1), (1, 15), (2, 3), (3, 2), (4, 8), (5, 9), (6, 7), (7, 0), (8, 5), (9, 6), (10, 11), (11, 12), (15, 16), (18, 14), (19, 17)]
d004.s010	Already on Thursday , the US bank was able to announce a capital increase of some USD 20 billion , reported CNBC with reference to circles .	CNBC援引圈子报道称，这家美国银行周四已经宣布增资约200亿美元。	already on thursday , the us bank be able to announce a capital increase of some usd 20 billion , report cnbc with reference to circle .	CNBC 援引 圈子 报道 称 ， 这家 美国 银行 周四 已经 宣布 增资 约 200亿 美元 。	CNBC 援引 圈子 报道 称 ， 这家 美国 银行 周四 已经 宣布 增资 约 200亿 美元 。	[(0, 10), (2, 9), (5, 7), (6, 8), (9, 4), (10, 11), (12, 12), (17, 14), (18, 14), (19, 16), (20, 3), (21, 0), (23, 1), (24, 13), (25, 2), (26, 16)]
d004.s011	A Citigroup spokesman declined to comment .	花旗集团发言人拒绝置评。	a citigroup spokesman decline to comment .	花旗 集团 发言人 拒绝 置评 。	花旗 集团 发言人 拒绝 置评 。	[(1, 1), (2, 2), (4, 3), (5, 4), (6, 5)]
d004.s012	Goldman Sachs , JP Morgan Chase and Morgan Stanley had already repaid their support in June .	高盛(Goldman Sachs)、摩根大通(JP Morgan Chase)和摩根士丹利(Morgan Stanley)已经在6月份偿还	goldman sach , jp morgan chase and morgan stanley have already repay they support in june .	高盛( Gold man Sachs) 、 摩根 大 通( JP Morgan Chase) 和 摩根士丹 利( Morgan Stanley ) 已经 在 6月份 偿还	高盛( Gold man Sachs) 、 摩根 大 通( JP Morgan Chase) 和 摩根士丹 利( Morgan Stanley ) 已经 在 6月份 偿还	[(0, 1), (1, 3), (2, 4), (3, 8), (4, 0), (5, 10), (6, 11), (7, 5), (8, 13), (10, 17), (11, 20), (13, 19), (14, 18), (15, 19)]
d005.s000	Cheshire Appeal Will Point to Twitter	柴郡上诉将指向Twitter	cheshire appeal will point to twitter	柴郡 上诉 将 指向 Twitter	柴郡 上诉 将 指向 Twitter	[(0, 0), (1, 1), (2, 2), (4, 3), (5, 4)]
d005.s001	There were half a dozen of them typing away in the courtroom rows .	一排排的法庭上，有六个人在打字。	there be half_a_dozen of they typing away in the courtroom row .	一排排 的 法庭 上 ， 有 六 个人 在 打字 。	一排排 的 法庭 上 ， 有 六 个人 在 打字 。	[(0, 5), (3, 1), (5, 9), (9, 2), (10, 2), (11, 10)]
d005.s002	Minute by minute , they sent out reports of gruesome testimony via Twitter .	每分钟，他们都会通过Twitter发送可怕证词的报告。	minute by minute , they send out report of gruesome testimony via twitter .	每 分钟 ， 他们 都会 通过 Twitter 发送 可怕 证词 的 报告 。	每 分钟 ， 他们 都会 通过 Twitter 发送 可怕 证词 的 报告 。	[(2, 1), (4, 3), (5, 7), (7, 11), (8, 10), (9, 8), (10, 9), (11, 5), (12, 6), (13, 12)]
d005.s003	In the end , the defense says , there were more than 140,000 Twitter messages about the trial that dealt with rape and children tied to their beds in a house that was set ablaze .	辩方说，最后，有超过14万条关于审判的Twitter消息，涉及强奸和将儿童绑在被点燃的房子里的床上。	in the end , the defense say , there be more than 140,000 twitter message about the trial that deal with rape and child tie to they bed in a house that be set ablaze .	辩方 说 ， 最后 ， 有 超过 14万 条 关于 审判 的 Twitter 消息 ， 涉及 强奸 和 将 儿童 绑 在 被 点燃 的 房子 里 的 床 上 。	辩方 说 ， 最后 ， 有 超过 14万 条 关于 审判 的 Twitter 消息 ， 涉及 强奸 和 将 儿童 绑 在 被 点燃 的 房子 里 的 床 上 。	[(0, 3), (4, 0), (6, 1), (8, 5), (10, 6), (12, 7), (13, 12), (14, 13), (15, 9), (17, 10), (19, 15), (21, 16), (22, 17), (23, 19), (25, 22), (27, 28), (28, 21), (29, 24), (30, 25), (33, 23), (34, 23), (35, 30)]
d005.s004	On Thursday , the widely followed trial of Steven J. Hayes , who was convicted of killing three members of a Cheshire , Conn. , family , is set to come to an official end with the judge 's imposition of the death sentence voted for by the jury .	周四，因杀害康涅狄格州柴郡一家三口而被定罪的史蒂文· J ·海耶斯（ Steven J. Hayes ）的审判将正式结束，陪审团投票赞成法官判处死刑。	on thursday , the widely follow trial of steven j. haye , who be convict of kill three member of a cheshire , conn. , family , be set to come to a official end with the judge 's imposition of the death sentence vote for by the jury .	周四 ， 因 杀害 康涅狄格州 柴郡 一家 三口 而 被 定罪 的 史蒂文 · J ·海耶斯 （ Steven J . Hayes ） 的 审判 将 正式 结束 ， 陪审团 投票 赞成 法官 判处 死刑 。	周四 ， 因 杀害 康涅狄格州 柴郡 一家 三口 而 被 定罪 的 史蒂文 · J ·海耶斯 （ Steven J . Hayes ） 的 审判 将 正式 结束 ， 陪审团 投票 赞成 法官 判处 死刑 。	[(1, 0), (3, 6), (8, 12), (9, 14), (10, 20), (13, 9), (14, 10), (15, 11), (16, 3), (17, 7), (18, 7), (23, 4), (26, 34), (29, 24), (31, 23), (32, 22), (33, 25), (34, 26), (37, 31), (42, 33), (44, 29), (48, 28), (49, 34)]
d005.s005	But lawyers for Mr. Hayes have already made court filings that sketch out appeals arguments that are likely to occupy the courts for years .	但海耶斯的律师已经提交了法庭文件，概述了可能在法庭上占据多年的上诉论点。	but lawyer for mr. haye have already make court filing that sketch out appeal argument that be likely to occupy the court for year .	但 海耶斯 的 律师 已经 提交 了 法庭 文件 ， 概述 了 可能 在 法庭 上 占据 多年 的 上诉 论点 。	但 海耶斯 的 律师 已经 提交 了 法庭 文件 ， 概述 了 可能 在 法庭 上 占据 多年 的 上诉 论点 。	[(0, 0), (1, 3), (3, 1), (4, 1), (6, 4), (8, 7), (9, 8), (11, 10), (13, 19), (14, 20), (15, 9), (17, 12), (18, 16), (20, 2), (21, 14), (22, 17), (24, 21)]
d005.s006	One of the most provocative is that the intense reporting on the trial - including mainstream reporters ' extensive use of Twitter - created a `` circus atmosphere '' and such widespread , instant saturation with inflammatory details that the jury was improperly swayed by public passions .	其中最具挑衅性的是，对审判的激烈报道-包括主流记者对Twitter的广泛使用-创造了一种“马戏团气氛” ，以及如此广泛，即时的煽动性细节，以至于陪审团被公众的激情不恰当地动摇了。	one of the most provocative be that the intense reporting on the trial - include mainstream reporter ' extensive use of twitter - create a `` circus atmosphere '' and such widespread , instant saturation with inflammatory detail that the jury be improperly sway by public passion .	其中 最 具 挑衅性 的 是 ， 对 审判 的 激烈 报道 - 包括 主流 记者 对T witter 的 广泛 使用 - 创造 了 一 种 “ 马戏团 气氛 ” ， 以及 如此 广泛 ， 即时 的 煽动性 细节 ， 以至于 陪审团 被 公众 的 激情 不 恰 当地 动摇 了 。	其中 最 具 挑衅性 的 是 ， 对 审判 的 激烈 报道 - 包括 主流 记者 对T witter 的 广泛 使用 - 创造 了 一 种 “ 马戏团 气氛 ” ， 以及 如此 广泛 ， 即时 的 煽动性 细节 ， 以至于 陪审团 被 公众 的 激情 不 恰 当地 动摇 了 。	[(0, 0), (1, 4), (3, 1), (4, 37), (5, 5), (6, 6), (7, 9), (8, 10), (9, 11), (10, 7), (12, 8), (13, 12), (14, 13), (15, 14), (16, 15), (18, 19), (19, 20), (20, 18), (21, 16), (22, 21), (23, 22), (24, 24), (25, 26), (26, 27), (27, 28), (28, 29), (29, 31), (30, 32), (31, 33), (33, 35), (34, 17), (37, 38), (38, 40), (40, 41), (43, 49), (45, 43), (46, 45), (47, 51)]
d005.s007	The claim could force appeals judges to grapple with the question of whether new technology requires new courtroom rules .	这一说法可能会迫使上诉法官努力解决新技术是否需要新的法庭规则的问题。	the claim could force appeal judge to grapple with the question of whether new technology require new courtroom rule .	这 一 说法 可能 会 迫使 上诉 法官 努力 解决 新 技术 是否 需要 新 的 法庭 规则 的 问题 。	这 一 说法 可能 会 迫使 上诉 法官 努力 解决 新 技术 是否 需要 新 的 法庭 规则 的 问题 。	[(0, 0), (1, 2), (2, 3), (3, 5), (4, 6), (5, 7), (6, 4), (10, 19), (11, 15), (12, 12), (13, 14), (14, 11), (15, 13), (16, 10), (17, 16), (18, 17), (19, 20)]
d005.s008	`` As I experienced it during this trial , I think there 's a real danger that the inclusion of new technology in the courtroom is affecting an individual 's fair-trial rights , '' said Thomas J. Ullmann , Mr. Hayes 's chief defense lawyer .	海耶斯的首席辩护律师托马斯· J ·乌尔曼（ Thomas J. Ullmann ）说： “正如我在这次审判中所经历的那样，我认为在法庭上使用新技术会影响个人的公平审判权，这是一个真正的危险。”	`` as I experience it during this trial , I think there ' a real danger that the inclusion of new technology in the courtroom be affect a individual 's fair-trial right , '' say thoma j. ullmann , mr. haye 's chief defense_lawyer .	海耶斯 的 首席 辩护 律师 托马斯· J ·乌尔曼 （ Thomas J . Ullmann ） 说 ： “ 正如 我 在 这次 审判 中 所 经历 的 那样 ， 我 认为 在 法庭 上 使用 新 技术 会 影响 个人 的 公平 审判权 ， 这是 一个 真正 的 危险 。 ”	海耶斯 的 首席 辩护 律师 托马斯· J ·乌尔曼 （ Thomas J . Ullmann ） 说 ： “ 正如 我 在 这次 审判 中 所 经历 的 那样 ， 我 认为 在 法庭 上 使用 新 技术 会 影响 个人 的 公平 审判权 ， 这是 一个 真正 的 危险 。 ”	[(0, 16), (1, 17), (2, 18), (3, 24), (6, 20), (7, 21), (9, 28), (10, 29), (13, 44), (14, 45), (15, 47), (16, 23), (18, 33), (20, 34), (21, 35), (22, 22), (24, 31), (26, 37), (28, 38), (29, 39), (30, 40), (31, 41), (32, 48), (33, 49), (34, 14), (35, 9), (36, 10), (37, 12), (40, 0), (41, 1), (42, 2), (43, 7), (44, 48)]
d005.s009	The trial judge , Jon C. Blue of State Superior Court , tersely rejected the claims in a ruling last week , saying that the news media were `` carefully controlled '' and that there was no evidence the jury was driven by passion .	州高等法院的审判法官乔恩· C ·布鲁（ Jon C. Blue ）在上周的一项裁决中简短地驳回了这些说法，称新闻媒体受到“仔细控制” ，没有证据表明陪审团是受激情驱使的。	the trial_judge , jon c. blue of state superior_court , tersely reject the claim in a ruling last week , say that the news_media be `` carefully controlled '' and that there be no evidence the jury be drive by passion .	州 高等 法院 的 审判 法官 乔恩· C ·布鲁 （ Jon C . Blue ） 在 上周 的 一 项 裁决 中 简短 地 驳回 了 这些 说法 ， 称 新闻 媒体 受到 “ 仔细 控制 ” ， 没有 证据 表明 陪审团 是 受 激情 驱使 的 。	州 高等 法院 的 审判 法官 乔恩· C ·布鲁 （ Jon C . Blue ） 在 上周 的 一 项 裁决 中 简短 地 驳回 了 这些 说法 ， 称 新闻 媒体 受到 “ 仔细 控制 ” ， 没有 证据 表明 陪审团 是 受 激情 驱使 的 。	[(1, 4), (3, 10), (4, 11), (5, 13), (6, 3), (7, 0), (8, 6), (10, 23), (11, 24), (12, 26), (13, 27), (14, 21), (15, 18), (16, 20), (17, 16), (19, 47), (20, 29), (22, 17), (23, 30), (25, 33), (26, 34), (27, 32), (28, 36), (33, 38), (34, 39), (36, 41), (37, 42), (40, 44), (41, 47)]
d005.s010	But that is not likely to be the last word on the issue .	但这不太可能是这个问题的最后一句话。	but that be not likely to be the last_word on the issue .	但 这不 太 可能 是 这个 问题 的 最后 一句话 。	但 这不 太 可能 是 这个 问题 的 最后 一句话 。	[(0, 0), (1, 1), (4, 3), (5, 4), (8, 9), (11, 6), (12, 10)]
d005.s011	For decades , appeals courts have recognized that coverage of notorious cases can raise questions about a trial 's fairness .	几十年来，上诉法院已经认识到，对臭名昭著案件的报道可能会引发对审判公正性的质疑。	for decade , appeals_court have recognize that coverage of notorious case can raise question about a trial 's fairness .	几十 年 来 ， 上诉 法院 已经 认识 到 ， 对 臭名昭著 案件 的 报道 可能 会 引发 对 审判 公正性 的 质疑 。	几十 年 来 ， 上诉 法院 已经 认识 到 ， 对 臭名昭著 案件 的 报道 可能 会 引发 对 审判 公正性 的 质疑 。	[(0, 2), (3, 5), (5, 7), (7, 14), (8, 13), (9, 11), (10, 12), (11, 16), (12, 17), (13, 22), (14, 18), (15, 19), (18, 20), (19, 23)]
