sentence_id	text	translation	lemma	translation_token	translation_lemma	alignment
d009.s003	One of the cases at issue was a suit brought by 26 states challenging the sweeping healthcare overhaul passed by Congress last year , a law that has been a rallying cry for conservative activists nationwide .	其中一个有争议的案件是26个州提起诉讼，质疑国会去年通过的全面医疗保健改革，这项法律一直是全国保守派活动家的口号。	one of the case at issue be a suit bring by 26 state challenge the sweeping healthcare overhaul pass by congress last year , a law that have be a rallying_cry for conservative activist nationwide .	其中 一个 有 争议 的 案件 是 26 个 州 提起 诉讼 ， 质疑 国会 去年 通过 的 全面 医疗 保健 改革 ， 这项 法律 一直 是 全国 保守派 活动家 的 口号 。	其中 一个 有 争议 的 案件 是 26 个 州 提起 诉讼 ， 质疑 国会 去年 通过 的 全面 医疗 保健 改革 ， 这项 法律 一直 是 全国 保守派 活动家 的 口号 。	[(0, 1), (3, 5), (7, 4), (8, 11), (11, 7), (12, 9), (13, 13), (15, 18), (16, 19), (17, 21), (19, 16), (20, 14), (21, 15), (24, 17), (25, 24), (28, 26), (29, 30), (30, 31), (32, 28), (33, 29), (34, 27), (35, 32)]
d009.s004	The justices agreed to hear the suit ; indeed , a landmark 5.5 - hour argument is expected in March , and the outcome is likely to further roil the 2012 presidential race , which will be in full swing by the time the court 's decision is released .	法官们同意审理该诉讼；事实上，预计3月将举行一场具有里程碑意义的5.5小时辩论，结果可能会进一步搅乱2012年总统大选，届时法院的裁决将全面展开。	the justice agree to hear the suit ; indeed , a landmark 5.5 - hour argument be expect in march , and the outcome be likely to further roil the 2012 presidential race , which will be in full swing by the time the court 's decision be release .	法官们 同意 审理 该 诉讼 ； 事实上 ， 预计 3月 将 举行 一 场 具有 里程碑 意义 的 5.5 小时 辩论 ， 结果 可能 会 进一步 搅乱 2012年 总统 大选 ， 届时 法院 的 裁决 将 全面 展开 。	法官们 同意 审理 该 诉讼 ； 事实上 ， 预计 3月 将 举行 一 场 具有 里程碑 意义 的 5.5 小时 辩论 ， 结果 可能 会 进一步 搅乱 2012年 总统 大选 ， 届时 法院 的 裁决 将 全面 展开 。	[(1, 0), (2, 1), (3, 2), (5, 3), (6, 4), (10, 12), (11, 15), (12, 18), (14, 19), (15, 20), (18, 6), (19, 9), (20, 38), (23, 22), (25, 23), (26, 10), (27, 25), (28, 26), (32, 29), (35, 35), (37, 33), (39, 37), (44, 32), (45, 17), (46, 34), (49, 38)]
d009.s005	The lawyer who will stand before the court and argue that the law should be thrown out is likely to be Paul Clement , who served as U.S. solicitor general during the George W. Bush administration .	站在法庭上并争辩说法律应该被抛弃的律师很可能是保罗·克莱门特，他在乔治· W ·布什政府期间担任美国副检察长。	the lawyer who will stand before the court and argue that the law should be throw out be likely to be paul clement , who serve as u.s. solicitor general during the george w. bush administration .	站 在 法庭 上 并 争辩 说 法律 应该 被 抛弃 的 律师 很 可能 是 保罗·克莱门特 ， 他 在 乔治· W ·布什 政府 期间 担任 美国 副检察长 。	站 在 法庭 上 并 争辩 说 法律 应该 被 抛弃 的 律师 很 可能 是 保罗·克莱门特 ， 他 在 乔治· W ·布什 政府 期间 担任 美国 副检察长 。	[(0, 0), (1, 12), (2, 11), (4, 0), (5, 1), (7, 2), (8, 4), (9, 5), (10, 6), (12, 7), (13, 8), (14, 9), (15, 10), (17, 13), (18, 14), (19, 15), (22, 16), (24, 18), (25, 25), (28, 27), (29, 27), (30, 24), (31, 19), (33, 21), (34, 22), (35, 23), (36, 28)]
d009.s006	Clement 's law firm , Bancroft PLLC , was one of almost two dozen firms that helped sponsor the annual dinner of the Federalist Society , a longstanding group dedicated to advocating conservative legal principles .	克莱门特的律师事务所Bancroft PLLC是帮助赞助联邦主义者协会年度晚宴的近二十家公司之一，该协会是一个长期致力于倡导保守法律原则的组织。	clement 's law_firm , bancroft pllc , be one of almost two_dozen firm that help sponsor the annual dinner of the federalist society , a longstanding group dedicate to advocate conservative legal_principle .	克莱门特 的 律师 事务所 Bancroft PLLC 是 帮助 赞助 联邦主义者 协会 年度 晚宴 的 近 二十 家 公司 之一 ， 该 协会 是 一个 长期 致力于 倡导 保守 法律 原则 的 组织 。	克莱门特 的 律师 事务所 Bancroft PLLC 是 帮助 赞助 联邦主义者 协会 年度 晚宴 的 近 二十 家 公司 之一 ， 该 协会 是 一个 长期 致力于 倡导 保守 法律 原则 的 组织 。	[(0, 0), (1, 1), (2, 2), (4, 4), (5, 5), (7, 6), (8, 18), (10, 14), (12, 17), (14, 7), (15, 8), (17, 11), (18, 12), (19, 30), (20, 20), (22, 10), (24, 23), (26, 31), (28, 26), (30, 27), (32, 32)]
d009.s007	Another firm that sponsored the dinner , Jones Day , represents one of the trade associations that challenged the law , the National Federation of Independent Business .	赞助晚宴的另一家公司琼斯·戴（ Jones Day ）代表着挑战法律的行业协会之一--全国独立企业联合会（ National Federation of Independent Business ）。	another firm that sponsor the dinner , jone day , represent one of the trade association that challenge the law , the national federation of independent business .	赞助 晚宴 的 另 一家 公司 琼斯·戴 （ Jones Day ） 代表 着 挑战 法律 的 行业 协会 之一 -- 全国 独立 企业 联合会 （ National Federation of Independent Business ） 。	赞助 晚宴 的 另 一家 公司 琼斯·戴 （ Jones Day ） 代表 着 挑战 法律 的 行业 协会 之一 -- 全国 独立 企业 联合会 （ National Federation of Independent Business ） 。	[(0, 3), (1, 5), (3, 0), (4, 4), (5, 1), (7, 8), (8, 9), (10, 11), (11, 18), (14, 16), (15, 17), (17, 13), (19, 14), (22, 20), (23, 23), (24, 27), (25, 21), (26, 29), (27, 31)]
d009.s008	Another sponsor was pharmaceutical giant Pfizer Inc , which has an enormous financial stake in the outcome of the litigation .	另一个赞助商是制药巨头辉瑞公司，该公司在诉讼结果中拥有巨大的经济利益。	another sponsor be pharmaceutical giant pfizer inc , which have a enormous financial stake in the outcome of the litigation .	另 一个 赞助商 是 制药 巨头 辉瑞 公司 ， 该 公司 在 诉讼 结果 中 拥有 巨大 的 经济 利益 。	另 一个 赞助商 是 制药 巨头 辉瑞 公司 ， 该 公司 在 诉讼 结果 中 拥有 巨大 的 经济 利益 。	[(0, 0), (1, 2), (2, 3), (4, 5), (5, 6), (9, 15), (10, 1), (11, 16), (13, 19), (14, 14), (15, 9), (16, 13), (17, 17), (19, 12), (20, 20)]
d009.s009	The dinner was held at a Washington hotel hours after the court 's conference over the case .	晚宴在法院就此案召开会议几小时后在华盛顿的一家酒店举行。	the dinner be hold at a washington hotel hour after the court 's conference over the case .	晚宴 在 法院 就此 案 召开 会议 几 小时 后 在 华盛顿 的 一家 酒店 举行 。	晚宴 在 法院 就此 案 召开 会议 几 小时 后 在 华盛顿 的 一家 酒店 举行 。	[(1, 0), (3, 15), (4, 3), (5, 12), (6, 11), (7, 14), (8, 8), (9, 9), (11, 2), (13, 6), (15, 13), (16, 4), (17, 16)]
d009.s010	In attendance was , among others , Mitch McConnell , the Senate 's top Republican and an avowed opponent of the healthcare law .	出席会议的有参议院最高共和党人米奇·麦康奈尔（ Mitch McConnell ） ，他是医疗保健法的公开反对者。	in attendance be , among other , mitch mcconnell , the senate 's top republican and a avowed opponent of the healthcare law .	出席 会议 的 有 参议院 最高 共和党人 米奇·麦康奈尔 （ Mitch McConnell ） ， 他 是 医疗 保健法 的 公开 反对者 。	出席 会议 的 有 参议院 最高 共和党人 米奇·麦康奈尔 （ Mitch McConnell ） ， 他 是 医疗 保健法 的 公开 反对者 。	[(0, 0), (1, 1), (2, 3), (5, 13), (7, 9), (8, 7), (10, 7), (11, 4), (13, 5), (14, 6), (15, 14), (17, 18), (18, 19), (19, 17), (21, 16), (22, 16), (23, 20)]
d009.s011	The featured guests at the dinner ? Scalia and Thomas .	晚宴上的特色嘉宾？ Scalia和Thomas。	the featured guest at the dinner ? scalium and thoma .	晚宴 上 的 特色 嘉宾 ？ Scalia 和 Thomas 。	晚宴 上 的 特色 嘉宾 ？ Scalia 和 Thomas 。	[(1, 3), (2, 4), (5, 0), (7, 6), (8, 7), (9, 8), (10, 9)]
d009.s012	It 's nothing new : The two justices have been attending Federalist Society events for years .	这不是什么新鲜事：这两位法官多年来一直参加联邦党人协会的活动。	it ' nothing new : the two justice have be attend federalist society event for year .	这不 是 什么 新鲜事 ： 这 两 位 法官 多年 来 一直 参加 联邦 党人 协会 的 活动 。	这不 是 什么 新鲜事 ： 这 两 位 法官 多年 来 一直 参加 联邦 党人 协会 的 活动 。	[(0, 0), (2, 2), (3, 3), (5, 5), (6, 6), (7, 8), (10, 12), (11, 13), (12, 15), (13, 17), (14, 10), (15, 9), (16, 18)]
d009.s013	And it 's nothing that runs afoul of ethics rules .	这与道德规则没有任何冲突。	and it ' nothing that run afoul of ethic rule .	这 与 道德 规则 没有 任何 冲突 。	这 与 道德 规则 没有 任何 冲突 。	[(0, 1), (1, 0), (8, 2), (9, 3), (10, 7)]
d009.s014	In fact , justices are exempt from the Code of Conduct that governs the actions of lower federal justices .	事实上，法官不受《行为守则》管辖下级联邦法官的行为。	in fact , justice be exempt from the code_of_conduct that govern the action of lower federal justice .	事实上 ， 法官 不 受 《 行为 守则 》 管辖 下级 联邦 法官 的 行为 。	事实上 ， 法官 不 受 《 行为 守则 》 管辖 下级 联邦 法官 的 行为 。	[(0, 0), (3, 2), (8, 7), (10, 9), (12, 14), (13, 13), (14, 10), (15, 11), (16, 12), (17, 15)]
d009.s015	If they were , they arguably fell under code 's Canon 4C , which states , `` A judge may attend fund-raising events of law-related and other organizations although the judge may not be a speaker , a guest of honor , or featured on the program of such an event . ''	如果是的话，它们可以说属于CODE的Canon 4C ，其中规定： “法官可以参加法律相关组织和其他组织的筹款活动，尽管法官可能不是演讲者、嘉宾或此类活动的节目特色。”	if they be , they arguably fall under code 's canon 4c , which state , `` a judge may attend fund-raising event of law-related and other organization although the judge may not be a speaker , a guest_of_honor , or feature on the program of such a event . ''	如果 是 的话 ， 它们 可以 说 属于 CODE 的 Canon 4 C ， 其中 规定 ： “ 法官 可以 参加 法律 相关 组织 和 其他 组织 的 筹款 活动 ， 尽管 法官 可能 不是 演讲者 、 嘉宾 或 此类 活动 的 节目 特色 。 ”	如果 是 的话 ， 它们 可以 说 属于 CODE 的 Canon 4 C ， 其中 规定 ： “ 法官 可以 参加 法律 相关 组织 和 其他 组织 的 筹款 活动 ， 尽管 法官 可能 不是 演讲者 、 嘉宾 或 此类 活动 的 节目 特色 。 ”	[(0, 0), (2, 1), (4, 4), (5, 6), (6, 7), (8, 8), (10, 10), (11, 11), (13, 14), (14, 15), (16, 17), (17, 9), (18, 18), (19, 19), (20, 20), (21, 28), (22, 29), (24, 21), (25, 24), (26, 25), (27, 23), (28, 31), (30, 32), (31, 5), (32, 34), (34, 27), (35, 37), (36, 36), (40, 38), (44, 42), (45, 41), (46, 39), (47, 43), (48, 40), (49, 44), (50, 45)]
d009.s016	Nevertheless , the sheer proximity of Scalia and Thomas to two of the law firms in the case , as well as to a company with a massive financial interest , was enough to alarm ethics-in-government activists .	尽管如此，斯卡利亚和托马斯与案件中的两家律师事务所以及一家拥有巨大经济利益的公司的绝对接近足以让政府道德活动人士感到震惊。	nevertheless , the sheer proximity of scalium and thoma to two of the law_firm in the case , as well as to a company with a massive financial interest , be enough to alarm ethics-in-government activist .	尽管 如此 ， 斯卡利亚 和 托马斯 与 案件 中 的 两 家 律师 事务所 以及 一家 拥有 巨大 经济 利益 的 公司 的 绝对 接近 足以 让 政府 道德 活动 人士 感到 震惊 。	尽管 如此 ， 斯卡利亚 和 托马斯 与 案件 中 的 两 家 律师 事务所 以及 一家 拥有 巨大 经济 利益 的 公司 的 绝对 接近 足以 让 政府 道德 活动 人士 感到 震惊 。	[(0, 0), (4, 24), (6, 3), (7, 4), (8, 5), (9, 6), (10, 10), (11, 9), (13, 12), (14, 8), (15, 15), (16, 7), (18, 14), (21, 16), (22, 20), (23, 21), (25, 22), (26, 17), (27, 18), (28, 19), (31, 25), (32, 26), (33, 32), (34, 29), (35, 30), (36, 33)]
d009.s017	`` This stunning breach of ethics and indifference to the code belies claims by several justices that the court abides by the same rules that apply to all other federal judges , '' said Bob Edgar , the president of Common Cause .	Common Cause总裁鲍勃·埃德加（ Bob Edgar ）说： “这种令人震惊的道德违背和对守则的漠不关心掩盖了几位法官的主张，即法院遵守适用于所有其他联邦法官的相同规则。”	`` this stunning breach of ethic and indifference to the code belie claim by several justice that the court abide by the same rule that apply to all other federal judge , '' say bob edgar , the president of common cause .	Common Cause 总裁 鲍勃·埃德加 （ Bob Edgar ） 说 ： “ 这种 令 人 震惊 的 道德 违背 和 对 守则 的 漠不关心 掩盖 了 几 位 法官 的 主张 ， 即 法院 遵守 适用于 所有 其他 联邦 法官 的 相同 规则 。 ”	Common Cause 总裁 鲍勃·埃德加 （ Bob Edgar ） 说 ： “ 这种 令 人 震惊 的 道德 违背 和 对 守则 的 漠不关心 掩盖 了 几 位 法官 的 主张 ， 即 法院 遵守 适用于 所有 其他 联邦 法官 的 相同 规则 。 ”	[(0, 10), (1, 11), (2, 0), (3, 17), (4, 15), (6, 18), (7, 20), (8, 19), (10, 16), (14, 25), (15, 38), (18, 32), (19, 33), (22, 40), (23, 41), (24, 31), (26, 29), (27, 35), (28, 36), (29, 37), (30, 27), (31, 42), (32, 43), (33, 8), (34, 5), (35, 6), (38, 2), (39, 39), (42, 42)]
d009.s018	`` The justices were wining and dining at a black-tie fundraiser with attorneys who have pending cases before the court . ''	“法官们正在黑领带筹款活动中与在法庭上有待审理案件的律师共进晚餐。”	`` the justice be wine and dine at a black-tie fundraiser with attorney who have pend case before the court . ''	“ 法官们 正在 黑领带 筹款 活动 中 与 在 法庭 上 有待 审理 案件 的 律师 共进 晚餐 。 ”	“ 法官们 正在 黑领带 筹款 活动 中 与 在 法庭 上 有待 审理 案件 的 律师 共进 晚餐 。 ”	[(0, 0), (1, 1), (2, 1), (5, 7), (6, 17), (8, 14), (9, 4), (10, 5), (12, 15), (13, 1), (16, 13), (17, 12), (18, 8), (19, 9), (20, 18), (21, 19)]
d009.s019	Their appearance and assistance in fundraising for this event undercuts any claims of impartiality , and is unacceptable .	他们的出现和对本次活动筹款的协助削弱了任何公正的主张，是不可接受的。	they appearance and assistance in fundraise for this event undercut any claim of impartiality , and be unacceptable .	他们 的 出现 和 对 本次 活动 筹款 的 协助 削弱 了 任何 公正 的 主张 ， 是 不可 接受 的 。	他们 的 出现 和 对 本次 活动 筹款 的 协助 削弱 了 任何 公正 的 主张 ， 是 不可 接受 的 。	[(0, 0), (1, 2), (2, 3), (3, 9), (4, 11), (5, 7), (6, 4), (7, 5), (8, 6), (9, 10), (10, 12), (11, 15), (12, 14), (17, 19), (18, 21)]
d009.s020	Scalia and Thomas have shown little regard for critics who say they too readily mix the business of the court with agenda-driven groups such as the Federalist Society .	斯卡利亚（ Scalia ）和托马斯（ Thomas ）很少关注批评者，他们说他们太容易将法院的业务与联邦党人协会（ Federalist Society ）等议程驱动的团体混为一谈。	scalium and thoma have show little regard for critic who say they too readily mix the business of the court with agenda-driven group such as the federalist society .	斯卡利亚 （ Scalia ） 和 托马斯 （ Thomas ） 很 少 关注 批评者 ， 他们 说 他们 太 容易 将 法院 的 业务 与 联邦 党人 协会 （ Federalist Society ） 等 议程 驱动 的 团体 混为一谈 。	斯卡利亚 （ Scalia ） 和 托马斯 （ Thomas ） 很 少 关注 批评者 ， 他们 说 他们 太 容易 将 法院 的 业务 与 联邦 党人 协会 （ Federalist Society ） 等 议程 驱动 的 团体 混为一谈 。	[(0, 2), (1, 4), (2, 5), (5, 10), (6, 11), (8, 12), (9, 14), (10, 15), (11, 16), (12, 17), (13, 18), (14, 19), (16, 22), (17, 21), (19, 20), (20, 23), (21, 32), (22, 35), (26, 28), (27, 29), (28, 37)]
d009.s021	And Thomas '' wife , Ginni , is a high-profile conservative activist .	托马斯的妻子金妮是一位备受瞩目的保守派活动家。	and thoma '' wife , ginnus , be a high-profile conservative activist .	托马斯 的 妻子 金妮 是 一 位 备受 瞩目 的 保守派 活动家 。	托马斯 的 妻子 金妮 是 一 位 备受 瞩目 的 保守派 活动家 。	[(1, 0), (3, 2), (5, 3), (7, 4), (8, 5), (9, 9), (10, 10), (11, 11), (12, 12)]
d009.s022	Moreover , conservatives argue that it 's Justice Elena Kagan who has an ethical issue , not Scalia and Thomas .	此外，保守派认为大法官埃琳娜·卡根（ Elena Kagan ）有道德问题，而不是斯卡利亚（ Scalia ）和托马斯（ Thomas ）。	moreover , conservative argue that it ' justice elena kagan who have a ethical issue , not scalium and thoma .	此外 ， 保守派 认为 大法官 埃琳娜·卡根 （ Elena Kagan ） 有 道德 问题 ， 而 不是 斯卡利亚 （ Scalia ） 和 托马斯 （ Thomas ） 。	此外 ， 保守派 认为 大法官 埃琳娜·卡根 （ Elena Kagan ） 有 道德 问题 ， 而 不是 斯卡利亚 （ Scalia ） 和 托马斯 （ Thomas ） 。	[(0, 0), (2, 2), (7, 4), (8, 7), (9, 8), (11, 10), (14, 12), (16, 15), (17, 18), (18, 20), (19, 23), (20, 25)]
d009.s023	Kagan served as solicitor general in the Obama administration when the first legal challenges to the law were brought at the trial court level .	卡根曾在奥巴马政府担任副检察长，当时对法律的第一次法律挑战是在审判法庭层面提出的。	kagan serve as solicitor_general in the obama administration when the first legal challenge to the law be bring at the trial_court level .	卡根 曾 在 奥巴马 政府 担任 副检察长 ， 当时 对 法律 的 第一 次 法律 挑战 是 在 审判 法庭 层面 提出 的 。	卡根 曾 在 奥巴马 政府 担任 副检察长 ， 当时 对 法律 的 第一 次 法律 挑战 是 在 审判 法庭 层面 提出 的 。	[(0, 0), (1, 5), (3, 6), (4, 2), (6, 3), (7, 4), (10, 12), (12, 15), (13, 9), (14, 13), (15, 10), (18, 8), (20, 19), (21, 20), (22, 23)]
d009.s024	Her critics have pushed for Kagan to recuse herself from hearing the case , saying that she was too invested in defending the law then to be impartial now .	她的批评者敦促卡根回避此案，称她当时在捍卫法律方面投入太多，现在不公正。	she critic have push for kagan to recuse herself from hear the case , say that she be too invest in defend the law then to be impartial now .	她 的 批评者 敦促 卡根 回避 此 案 ， 称 她 当时 在 捍卫 法律 方面 投入 太 多 ， 现在 不 公正 。	她 的 批评者 敦促 卡根 回避 此 案 ， 称 她 当时 在 捍卫 法律 方面 投入 太 多 ， 现在 不 公正 。	[(0, 0), (1, 2), (3, 3), (5, 4), (6, 5), (11, 6), (12, 7), (14, 9), (16, 10), (18, 17), (20, 18), (21, 13), (23, 14), (24, 11), (25, 16), (27, 22), (28, 20), (29, 23)]
d009.s025	Kagan has given no indication she will do so .	Kagan没有表示她会这样做。	kagan have give no indication she will do so .	Kagan 没有 表示 她 会 这样 做 。	Kagan 没有 表示 她 会 这样 做 。	[(0, 0), (2, 2), (5, 3), (6, 4), (7, 6), (8, 5), (9, 7)]
d010.s000	The familiarity of the Spanish is higher than that of the Ticos	西班牙人的熟悉程度高于提科人	the familiarity of the spanish be higher than that of the tico	西班牙人 的 熟悉 程度 高于 提科人	西班牙人 的 熟悉 程度 高于 提科人	[(1, 2), (2, 1), (4, 0), (6, 4), (11, 5)]
d010.s001	Of the 22 players called in Spain , ten passed 50 international games .	在西班牙招募的22名球员中，有10名通过了50场国际比赛。	of the 22 player call in spain , ten pass 50 international game .	在 西班牙 招募 的 22 名 球员 中 ， 有 10 名 通过 了 50 场 国际 比赛 。	在 西班牙 招募 的 22 名 球员 中 ， 有 10 名 通过 了 50 场 国际 比赛 。	[(0, 3), (2, 4), (3, 6), (4, 2), (5, 7), (6, 1), (8, 10), (9, 12), (10, 14), (11, 16), (12, 17), (13, 18)]
d010.s002	On the side of Costa Rica only one of 22 called players reached 50 games .	在哥斯达黎加方面， 22名被称为球员的球员中只有一人达到了50场比赛。	on the side of costa_rica only one of 22 call player reach 50 game .	在 哥斯达黎加 方面 ， 22 名 被 称为 球员 的 球员 中 只有 一 人 达到 了 50 场 比赛 。	在 哥斯达黎加 方面 ， 22 名 被 称为 球员 的 球员 中 只有 一 人 达到 了 50 场 比赛 。	[(0, 0), (2, 2), (4, 1), (5, 12), (6, 13), (7, 9), (8, 4), (9, 8), (10, 10), (11, 15), (12, 17), (13, 19), (14, 20)]
d010.s003	A minor contrast to Costa Rica , comparing the 22 players called by both countries for the friendly game today , at 3:05 pm at the National Stadium in San Jose .	与哥斯达黎加略有不同的是，两国今天下午3:05在圣何塞国家体育场召集了22名球员参加友谊赛。	a minor contrast to costa_rica , compare the 22 player call by both country for the friendly game today , at 3:05 pm at the national stadium in san_jose .	与 哥斯达黎 加略 有 不同 的 是 ， 两 国 今天 下午 3 : 05 在 圣何塞 国家 体育场 召集 了 22 名 球员 参加 友谊赛 。	与 哥斯达黎 加略 有 不同 的 是 ， 两 国 今天 下午 3 : 05 在 圣何塞 国家 体育场 召集 了 22 名 球员 参加 友谊赛 。	[(0, 5), (2, 4), (3, 0), (4, 2), (8, 21), (9, 23), (10, 19), (12, 8), (13, 9), (16, 25), (18, 10), (22, 11), (26, 18), (27, 20), (29, 26)]
d010.s004	While the Europe and world champions , number one one in the monthly top of FIFA , have a long record of Class A inter selection , the Tricolor has only the defender Michael Umana as the only one who has 50 international games .	虽然欧洲冠军和世界冠军是国际足联每月排名第一的冠军，在A级间选择方面有着悠久的记录，但三色球只有后卫迈克尔·乌马纳（ Michael Umana ）是唯一拥有50场国际比赛的冠军。	while the europe and world champion , number_one one in the monthly top of fifa , have a long record of class a inter selection , the tricolor have only the defender michael umana as the only one who have 50 international game .	虽然 欧洲 冠军 和 世界 冠军 是 国际 足联 每月 排名 第一 的 冠军 ， 在 A级间 选择 方面 有着 悠久 的 记录 ， 但 三色球 只有 后卫 迈克尔·乌马纳 （ Michael Umana ） 是 唯一 拥有 50 场 国际 比赛 的 冠军 。	虽然 欧洲 冠军 和 世界 冠军 是 国际 足联 每月 排名 第一 的 冠军 ， 在 A级间 选择 方面 有着 悠久 的 记录 ， 但 三色球 只有 后卫 迈克尔·乌马纳 （ Michael Umana ） 是 唯一 拥有 50 场 国际 比赛 的 冠军 。	[(0, 0), (2, 1), (3, 3), (4, 4), (5, 2), (7, 5), (8, 11), (9, 15), (11, 9), (13, 12), (14, 8), (15, 42), (18, 20), (19, 22), (21, 10), (24, 17), (27, 25), (28, 19), (29, 26), (30, 21), (31, 27), (32, 30), (33, 31), (36, 34), (39, 35), (40, 36), (41, 38), (42, 39), (43, 42)]
d010.s005	That number was reached Friday before the game against Panama ( 0-2 ) , in Rommel Fernandez .	这个数字是在周五在隆美尔·费尔南德斯（ Rommel Fernandez ）对阵巴拿马（ 0-2 ）的比赛前达到的。	that number be reach friday before the game against panama ( 0-2 ) , in rommel fernandez .	这个 数字 是 在 周五 在 隆美尔·费尔南德斯 （ Rommel Fernande z ） 对阵 巴拿马 （ 0 -2 ） 的 比赛 前 达到 的 。	这个 数字 是 在 周五 在 隆美尔·费尔南德斯 （ Rommel Fernande z ） 对阵 巴拿马 （ 0 -2 ） 的 比赛 前 达到 的 。	[(0, 0), (1, 1), (3, 21), (4, 4), (5, 20), (6, 18), (7, 19), (8, 12), (9, 13), (11, 16), (14, 5), (15, 8), (16, 10), (17, 23)]
