sentence_id	text	translation	lemma	translation_token	translation_lemma	alignment
d007.s002	While researchers discovered the unusual bacteria here in Earth , they say it shows that life has possibilities beyond the major elements that have been considered essential .	虽然研究人员在地球上发现了这种不寻常的细菌，但他们表示，这表明生命的可能性超出了被认为是必不可少的主要元素。	while researcher discover the unusual bacterium here in earth , they say it show that life have possibility beyond the major element that have be consider essential .	虽然 研究 人员 在 地球 上 发现 了 这种 不 寻常 的 细菌 ， 但 他们 表示 ， 这 表明 生命 的 可能性 超出 了 被 认为 是 必不可少 的 主要 元素 。	虽然 研究 人员 在 地球 上 发现 了 这种 不 寻常 的 细菌 ， 但 他们 表示 ， 这 表明 生命 的 可能性 超出 了 被 认为 是 必不可少 的 主要 元素 。	[(0, 0), (1, 1), (2, 6), (3, 4), (4, 8), (5, 12), (7, 7), (10, 15), (11, 16), (13, 19), (15, 20), (17, 22), (19, 18), (20, 30), (21, 31), (24, 27), (25, 26), (26, 28), (27, 32)]
d007.s003	`` This organism has dual capability . ''	“这种生物具有双重能力。”	`` this organism have dual capability . ''	“ 这种 生物 具有 双重 能力 。 ”	“ 这种 生物 具有 双重 能力 。 ”	[(0, 0), (1, 1), (2, 2), (3, 3), (4, 4), (5, 5), (6, 6), (7, 7)]
d007.s004	`` It can grow with either phosphorus or arsenic . ''	“它可以与磷或砷一起生长。”	`` it can grow with either phosphorus or arsenic . ''	“ 它 可以 与 磷 或 砷一起 生长 。 ”	“ 它 可以 与 磷 或 砷一起 生长 。 ”	[(0, 0), (1, 1), (2, 2), (3, 7), (4, 3), (6, 4), (7, 5), (8, 6), (9, 8), (10, 9)]
d007.s005	`` That makes it very peculiar , though it falls short of being some form of truly ` alien ' life , '' commented Paul C. W. Davies of Arizona State University , a co-author of the report appearing in Thursday 's online edition of the journal Science .	亚利桑那州立大学的保罗· C · W ·戴维斯（ Paul C. W. Davies ）评论说： “这使得它非常奇怪，尽管它没有成为某种形式的真正的`外星人'生活，”该报告的合著者出现在周四的在线版《科学》杂志上。	`` that make it very peculiar , though it fall short of be some form of truly ` alien ' life , '' comment paul c. w. davy of arizona state university , a co-author of the report appear in thursday 's online edition of the journal science .	亚利桑那 州立 大学 的 保罗· C · W ·戴维斯 （ Paul C . W . Davies ） 评论 说 ： “ 这 使得 它 非常 奇怪 ， 尽管 它 没有 成为 某种 形式 的 真正 的 `外 星人 ' 生活 ， ” 该 报告 的 合著者 出现 在 周四 的 在线版 《 科学 》 杂志 上 。	亚利桑那 州立 大学 的 保罗· C · W ·戴维斯 （ Paul C . W . Davies ） 评论 说 ： “ 这 使得 它 非常 奇怪 ， 尽管 它 没有 成为 某种 形式 的 真正 的 `外 星人 ' 生活 ， ” 该 报告 的 合著者 出现 在 周四 的 在线版 《 科学 》 杂志 上 。	[(0, 20), (2, 22), (3, 23), (4, 24), (5, 25), (8, 28), (11, 29), (12, 30), (13, 31), (14, 32), (15, 33), (16, 34), (18, 15), (20, 39), (22, 41), (23, 17), (24, 10), (25, 11), (26, 13), (27, 8), (28, 3), (29, 0), (30, 1), (31, 2), (33, 35), (34, 45), (35, 44), (36, 42), (37, 43), (38, 46), (39, 27), (40, 48), (42, 50), (43, 50), (44, 49), (45, 21), (46, 54), (47, 52), (48, 56)]
d007.s006	Six major elements have long been considered essential for life - carbon , hydrogen , nitrogen , oxygen , phosphorus and sulfur .	长期以来，人们一直认为六种主要元素对生命至关重要--碳、氢、氮、氧、磷和硫。	six major element have long be consider essential for life - carbon , hydrogen , nitrogen , oxygen , phosphorus and sulfur .	长期 以来 ， 人们 一直 认为 六 种 主要 元素 对 生命 至关重要 -- 碳 、 氢 、 氮 、 氧 、 磷和硫 。	长期 以来 ， 人们 一直 认为 六 种 主要 元素 对 生命 至关重要 -- 碳 、 氢 、 氮 、 氧 、 磷和硫 。	[(0, 6), (1, 8), (2, 9), (4, 0), (6, 5), (7, 12), (8, 10), (9, 11), (11, 14), (12, 15), (13, 16), (14, 21), (15, 18), (16, 19), (17, 20), (18, 17), (19, 22), (20, 22), (21, 22), (22, 23)]
d007.s007	But the researchers found that the bacteria , discovered in Mono Lake , Calif. , is able to continue to grow after substituting arsenic for phosphorus .	但研究人员发现，在加利福尼亚州莫诺湖发现的这种细菌在用砷代替磷后能够继续生长。	but the researcher find that the bacterium , discover in mono lake , calif. , be able to continue to grow after substitute arsenic for phosphorus .	但 研究 人员 发现 ， 在 加利福尼亚州 莫诺湖 发现 的 这种 细菌 在 用 砷代 替 磷后 能够 继续 生长 。	但 研究 人员 发现 ， 在 加利福尼亚州 莫诺湖 发现 的 这种 细菌 在 用 砷代 替 磷后 能够 继续 生长 。	[(0, 0), (1, 9), (2, 2), (3, 3), (5, 10), (6, 11), (8, 8), (9, 5), (10, 14), (11, 7), (16, 17), (17, 13), (18, 18), (20, 19), (21, 12), (22, 15), (23, 16), (25, 16), (26, 20)]
d007.s008	`` It makes you wonder what else is possible , '' said Ariel D. Anbar of Arizona State University , a co-author of the report .	该报告的合著者、亚利桑那州立大学的阿里尔· D ·安巴尔（ Ariel D. Anbar ）说： “这让你想知道还有什么是可能的。”	`` it make you wonder what else be possible , '' say ariel d. anbar of arizona state university , a co-author of the report .	该 报告 的 合著者 、 亚利桑那 州立 大学 的 阿里尔· D ·安巴尔 （ Ariel D . Anbar ） 说 ： “ 这 让 你 想 知道 还有 什么 是 可能 的 。 ”	该 报告 的 合著者 、 亚利桑那 州立 大学 的 阿里尔· D ·安巴尔 （ Ariel D . Anbar ） 说 ： “ 这 让 你 想 知道 还有 什么 是 可能 的 。 ”	[(0, 20), (1, 21), (2, 22), (3, 23), (4, 24), (5, 27), (6, 26), (7, 28), (8, 29), (9, 31), (10, 32), (11, 18), (12, 9), (13, 14), (14, 16), (15, 8), (16, 5), (17, 6), (18, 7), (19, 4), (20, 30), (21, 9), (22, 2), (23, 0), (24, 1), (25, 31)]
d007.s009	The find is important in the search for life beyond Earth because researchers need to be able to recognize life , to know what life looks like , Anbar said .	安巴尔说，这一发现对于寻找地球以外的生命非常重要，因为研究人员需要能够识别生命，了解生命的样子。	the find be important in the search for life beyond earth because researcher need to be able to recognize life , to know what life look like , anbar say .	安巴尔 说 ， 这 一 发现 对于 寻找 地球 以外 的 生命 非常 重要 ， 因为 研究 人员 需要 能够 识别 生命 ， 了解 生命 的 样子 。	安巴尔 说 ， 这 一 发现 对于 寻找 地球 以外 的 生命 非常 重要 ， 因为 研究 人员 需要 能够 识别 生命 ， 了解 生命 的 样子 。	[(1, 5), (3, 13), (4, 6), (6, 7), (8, 11), (9, 9), (10, 8), (11, 15), (12, 16), (13, 18), (17, 10), (18, 20), (19, 21), (21, 19), (22, 23), (24, 24), (25, 26), (29, 1), (30, 27)]
d007.s010	The study focuses on a microbe found on Earth .	这项研究的重点是在地球上发现的一种微生物。	the study focus on a microbe find on earth .	这项 研究 的 重点 是 在 地球 上 发现 的 一 种 微生物 。	这项 研究 的 重点 是 在 地球 上 发现 的 一 种 微生物 。	[(0, 6), (1, 1), (2, 3), (4, 10), (5, 12), (6, 8), (7, 7), (9, 13)]
d007.s011	However , the announcement of a news conference to discuss it , which did not disclose details of the find , generated widespread speculation on the Internet that the report would disclose the discovery of extraterrestrial life .	然而，没有透露这一发现细节的新闻发布会的宣布在互联网上引起了广泛的猜测，即该报告将披露外星生命的发现。	however , the announcement of a news_conference to discuss it , which do not disclose detail of the find , generate widespread speculation on the internet that the report would disclose the discovery of extraterrestrial life .	然而 ， 没有 透露 这 一 发现 细节 的 新闻 发布会 的 宣布 在 互联网 上 引起 了 广泛 的 猜测 ， 即 该 报告 将 披露 外星 生命 的 发现 。	然而 ， 没有 透露 这 一 发现 细节 的 新闻 发布会 的 宣布 在 互联网 上 引起 了 广泛 的 猜测 ， 即 该 报告 将 披露 外星 生命 的 发现 。	[(0, 0), (3, 12), (4, 8), (5, 5), (6, 9), (7, 6), (14, 3), (15, 7), (16, 11), (17, 4), (20, 16), (21, 18), (22, 20), (23, 15), (25, 14), (26, 22), (27, 23), (28, 24), (30, 26), (32, 30), (33, 29), (34, 27), (35, 28), (36, 31)]
d007.s012	It did n't .	它没有。	it do n't .	它 没有 。	它 没有 。	[(0, 0), (3, 2)]
d007.s013	The discovery `` does show that in other planetary environments organisms might be able to use other elements to drive biochemistry and that the ` standard ' set of elements we think are absolutely necessary for life might not be so fixed , '' commented Charles Cockell , professor at Planetary and Space Sciences Research Institute , Open University , in Milton Keynes , United Kingdom .	这一发现确实表明，在其他行星环境中，生物体可能能够利用其他元素来驱动生物化学，而且我们认为对生命绝对必要的“标准”元素集合可能不是那么固定， “英国米尔顿凯恩斯开放大学行星与空间科学研究所教授Charles Cockell评论道。	the discovery `` do show that in other planetary environment organism might be able to use other element to drive biochemistry and that the ` standard ' set of element we think be absolutely necessary for life might not be so fixed , '' comment charle cockell , professor at planetary and space science research institute , open_university , in milton keyne , united_kingdom .	这 一 发现 确实 表明 ， 在 其他 行星 环境 中 ， 生物体 可能 能够 利用 其他 元素 来 驱动 生物 化学 ， 而且 我们 认为 对 生命 绝对 必要 的 “ 标准 ” 元素 集合 可能 不是 那么 固定 ， “ 英国 米尔顿 凯恩斯 开放 大学 行星 与 空间 科学 研究所 教授 Charles Cockell 评论道 。	这 一 发现 确实 表明 ， 在 其他 行星 环境 中 ， 生物体 可能 能够 利用 其他 元素 来 驱动 生物 化学 ， 而且 我们 认为 对 生命 绝对 必要 的 “ 标准 ” 元素 集合 可能 不是 那么 固定 ， “ 英国 米尔顿 凯恩斯 开放 大学 行星 与 空间 科学 研究所 教授 Charles Cockell 评论道 。	[(0, 0), (1, 2), (4, 4), (5, 5), (6, 10), (7, 7), (8, 8), (9, 9), (10, 12), (11, 13), (14, 14), (15, 15), (16, 16), (17, 34), (18, 18), (19, 19), (20, 21), (21, 22), (23, 46), (25, 32), (27, 35), (28, 30), (29, 17), (30, 24), (31, 25), (33, 28), (34, 29), (35, 26), (36, 27), (37, 36), (38, 37), (41, 39), (43, 41), (44, 55), (45, 53), (46, 54), (48, 52), (50, 47), (51, 48), (52, 49), (53, 50), (54, 51), (59, 38), (60, 43), (61, 44), (63, 44), (64, 56)]
d007.s014	Cockell was not part of the research team .	Cockell不是研究团队的一员。	cockell be not part of the research team .	Cockell 不是 研究 团队 的 一员 。	Cockell 不是 研究 团队 的 一员 。	[(0, 0), (2, 1), (3, 5), (4, 4), (6, 2), (7, 3), (8, 6)]
d007.s015	`` This work is novel because it shows the substitution of one element for another in fundamental biochemistry and biochemical structure , '' added Cockell .	“这项工作是新颖的，因为它显示了一种元素在基础生物化学和生物化学结构中替代另一种元素，” Cockell补充道。	`` this work be novel because it show the substitution of one element for another in fundamental biochemistry and biochemical structure , '' add cockell .	“ 这项 工作 是 新颖 的 ， 因为 它 显示 了 一 种 元素 在 基础 生物 化学 和 生物 化学 结构 中 替代 另 一 种 元素 ， ” Cockell补 充道 。	“ 这项 工作 是 新颖 的 ， 因为 它 显示 了 一 种 元素 在 基础 生物 化学 和 生物 化学 结构 中 替代 另 一 种 元素 ， ” Cockell补 充道 。	[(0, 0), (1, 1), (2, 2), (3, 3), (4, 4), (5, 7), (6, 8), (7, 9), (9, 23), (10, 5), (11, 11), (12, 13), (14, 24), (15, 22), (16, 15), (17, 16), (18, 18), (19, 20), (20, 21), (22, 29), (23, 30), (24, 30), (25, 32)]
d007.s016	It was n't a chance discovery .	这不是偶然的发现。	it be n't a chance discovery .	这不 是 偶然 的 发现 。	这不 是 偶然 的 发现 。	[(0, 0), (1, 1), (3, 3), (4, 2), (5, 4), (6, 5)]
d007.s017	Felisa Wolfe-Simon of NASA 's Astrobiology Institute , who led the study , targeted Mono Lake because it has high arsenic levels .	领导这项研究的美国宇航局天体生物学研究所的Felisa Wolfe-Simon瞄准了Mono Lake ，因为它的砷含量很高。	felisa wolfe-simon of nasa 's astrobiology institute , who lead the study , target mono lake because it have high arsenic level .	领导 这项 研究 的 美国 宇航局 天体 生物学 研究所 的 Felis a Wolfe-Simon 瞄准 了 Mono Lake ， 因为 它 的 砷含量 很 高 。	领导 这项 研究 的 美国 宇航局 天体 生物学 研究所 的 Felis a Wolfe-Simon 瞄准 了 Mono Lake ， 因为 它 的 砷含量 很 高 。	[(0, 10), (1, 12), (2, 3), (3, 4), (5, 6), (6, 8), (9, 0), (10, 20), (11, 2), (12, 24), (13, 9), (14, 15), (15, 16), (16, 18), (17, 19), (18, 13), (19, 23), (20, 21), (21, 21), (22, 24)]
d007.s018	Arsenic and phosphorus are chemically similar , so she speculated that a microbe exposed to both might be able to substitute one for the other .	砷和磷在化学上是相似的，因此她推测暴露于两者的微生物可能能够替代另一种微生物。	arsenic and phosphorus be chemically similar , so she speculate that a microbe expose to both might be able to substitute one for the other .	砷和磷 在 化学 上 是 相似 的 ， 因此 她 推测 暴露 于 两者 的 微生物 可能 能够 替代 另 一 种 微生物 。	砷和磷 在 化学 上 是 相似 的 ， 因此 她 推测 暴露 于 两者 的 微生物 可能 能够 替代 另 一 种 微生物 。	[(0, 0), (1, 0), (2, 0), (3, 4), (4, 2), (5, 5), (7, 8), (8, 9), (9, 10), (11, 20), (12, 15), (13, 11), (14, 12), (15, 13), (16, 16), (18, 17), (19, 18), (20, 14), (24, 19), (25, 23)]
d007.s019	`` Arsenic is toxic mainly because its chemical behavior is so similar to that of phosphorus . ''	“砷是有毒的，主要是因为它的化学行为与磷非常相似。”	`` arsenic be toxic mainly because its chemical behavior be so similar to that of phosphorus . ''	“ 砷是 有毒 的 ， 主要 是 因为 它 的 化学 行为 与 磷 非常 相似 。 ”	“ 砷是 有毒 的 ， 主要 是 因为 它 的 化学 行为 与 磷 非常 相似 。 ”	[(0, 0), (1, 1), (2, 1), (3, 2), (4, 5), (5, 7), (6, 8), (7, 10), (8, 11), (10, 14), (11, 15), (12, 12), (14, 9), (15, 13), (16, 16), (17, 17)]
d007.s020	`` As a result , organisms have a hard time telling these elements apart . ''	“因此，生物很难区分这些元素。”	`` as a result , organism have a hard_time tell these element apart . ''	“ 因此 ， 生物 很 难 区分 这些 元素 。 ”	“ 因此 ， 生物 很 难 区分 这些 元素 。 ”	[(0, 0), (1, 1), (5, 3), (6, 4), (8, 6), (9, 6), (10, 7), (11, 8), (12, 6), (13, 9), (14, 10)]
d007.s021	`` But arsenic is different enough that it does n't work as well as phosphorus , so it gets in there and sort of gums up the works of our biochemical machinery , '' explained Anbar .	Anbar解释说： “但砷的不同之处在于它不像磷那样有效，所以它会进入那里，并把我们的生化机器的工作变成牙龈。”	`` but arsenic be different enough that it do n't work as well as phosphorus , so it get in there and sort of gum up the work of we biochemical machinery , '' explain anbar .	Anbar 解释 说 ： “ 但 砷 的 不同 之 处 在于 它 不 像 磷 那样 有效 ， 所以 它 会 进入 那里 ， 并 把 我们 的 生化 机器 的 工作 变成 牙龈 。 ”	Anbar 解释 说 ： “ 但 砷 的 不同 之 处 在于 它 不 像 磷 那样 有效 ， 所以 它 会 进入 那里 ， 并 把 我们 的 生化 机器 的 工作 变成 牙龈 。 ”	[(0, 4), (1, 5), (2, 6), (3, 2), (4, 8), (6, 16), (7, 12), (9, 13), (13, 14), (14, 15), (16, 19), (17, 20), (19, 17), (20, 23), (21, 25), (23, 7), (26, 31), (27, 32), (29, 27), (30, 29), (31, 30), (33, 36), (34, 1), (35, 0), (36, 35)]
d007.s022	The researchers collected the bacteria known as GFAJ-1 and exposed it to increasing concentrations of arsenic , which it was able to adapt to and grow .	研究人员收集了称为GFAJ-1的细菌，并将其暴露于不断增加的砷浓度中，使其能够适应并生长。	the researcher collect the bacterium know as gfaj-1 and expose it to increase concentration of arsenic , which it be able to adapt to and grow .	研究 人员 收集 了 称为 G FAJ-1 的 细菌 ， 并 将 其 暴露 于 不断 增加 的 砷 浓度 中 ， 使 其 能够 适应 并 生长 。	研究 人员 收集 了 称为 G FAJ-1 的 细菌 ， 并 将 其 暴露 于 不断 增加 的 砷 浓度 中 ， 使 其 能够 适应 并 生长 。	[(0, 0), (1, 1), (2, 2), (3, 7), (4, 8), (5, 4), (7, 6), (8, 10), (9, 13), (10, 12), (11, 14), (12, 16), (13, 19), (14, 17), (15, 18), (18, 23), (20, 24), (21, 22), (23, 25), (24, 26), (25, 27), (26, 28)]
d007.s023	The microbe does grow better on phosphorus , but showing that it can live with arsenic instead raises the possibility that a life form using arsenic could occur naturally , either elsewhere on Earth or on another planet or moon where arsenic is more common .	微生物确实在磷上生长得更好，但表明它可以与砷共存，反而提高了使用砷的生命形式自然发生的可能性，无论是在地球上的其他地方，还是在砷更常见的另一个星球或月球上。	the microbe do grow better on phosphorus , but show that it can live with arsenic instead raise the possibility that a life_form use arsenic could occur naturally , either elsewhere on earth or on another planet or moon where arsenic be more common .	微生物 确实 在 磷上 生长 得 更 好 ， 但 表明 它 可以 与 砷 共存 ， 反而 提高 了 使用 砷 的 生命 形式 自然 发生 的 可能性 ， 无论是 在 地球 上 的 其他 地方 ， 还是 在 砷 更 常见 的 另 一个 星球 或 月球 上 。	微生物 确实 在 磷上 生长 得 更 好 ， 但 表明 它 可以 与 砷 共存 ， 反而 提高 了 使用 砷 的 生命 形式 自然 发生 的 可能性 ， 无论是 在 地球 上 的 其他 地方 ， 还是 在 砷 更 常见 的 另 一个 星球 或 月球 上 。	[(1, 0), (3, 4), (5, 7), (6, 3), (8, 9), (9, 10), (11, 11), (12, 12), (13, 15), (14, 13), (15, 14), (16, 17), (17, 18), (19, 28), (21, 45), (22, 24), (23, 20), (24, 21), (26, 26), (27, 25), (31, 33), (32, 32), (33, 38), (34, 49), (35, 44), (36, 46), (37, 47), (38, 48), (40, 40), (42, 6), (43, 42), (44, 50)]
d007.s024	Jamie S. Foster , an assistant professor of microbiology at the University of Florida , said the idea that arsenic could be substituted for phosphorus is n't new , but there has never been example where it was shown to work .	佛罗里达大学微生物学助理教授杰米· S ·福斯特（ Jamie S. Foster ）表示，砷可以替代磷的想法并不新鲜，但从未有过它被证明有效的例子。	jamie s. foster , a assistant_professor of microbiology at the university of florida , say the idea that arsenic could be substitute for phosphorus be n't new , but there have never be example where it be show to work .	佛罗里达 大学 微生 物学 助理 教授 杰米· S ·福斯特 （ Jamie S . Foster ） 表示 ， 砷 可以 替代 磷 的 想法 并不 新鲜 ， 但 从未有过 它 被 证明 有效 的 例子 。	佛罗里达 大学 微生 物学 助理 教授 杰米· S ·福斯特 （ Jamie S . Foster ） 表示 ， 砷 可以 替代 磷 的 想法 并不 新鲜 ， 但 从未有过 它 被 证明 有效 的 例子 。	[(0, 6), (1, 11), (2, 13), (5, 4), (7, 3), (10, 1), (12, 0), (14, 15), (15, 21), (16, 22), (18, 17), (19, 18), (21, 19), (23, 20), (25, 23), (26, 24), (28, 26), (29, 27), (31, 27), (33, 33), (35, 28), (38, 30), (39, 31), (40, 34)]
d007.s025	Arsenic was more common in the early times on Earth , she said , so researchers have speculated that early life forms might have used it .	她说，砷在地球的早期更常见，因此研究人员推测早期生命形式可能使用过它。	arsenic be more common in the early time on earth , she say , so researcher have speculate that early life_form might have use it .	她 说 ， 砷 在 地球 的 早期 更 常见 ， 因此 研究 人员 推测 早期 生命 形式 可能 使用 过 它 。	她 说 ， 砷 在 地球 的 早期 更 常见 ， 因此 研究 人员 推测 早期 生命 形式 可能 使用 过 它 。	[(0, 3), (2, 8), (3, 9), (4, 4), (5, 5), (6, 7), (11, 0), (12, 1), (14, 11), (15, 13), (17, 14), (19, 15), (20, 17), (21, 18), (23, 19), (24, 21), (25, 22)]
d007.s026	`` It does suggest that that there could be other ways to form life , not just how life formed on early Earth , '' said Foster , who was not part of Wolfe-Simon 's research team .	“这确实表明，可能还有其他形成生命的方式，而不仅仅是生命在早期地球上的形成方式，”福斯特说，他不是沃尔夫-西蒙研究小组的一员。	`` it do suggest that that there could be other way to form life , not just how life form on early earth , '' say foster , who be not part of wolfe-simon 's research team .	“ 这 确实 表明 ， 可能 还有 其他 形成 生命 的 方式 ， 而 不仅仅 是 生命 在 早期 地球 上 的 形成 方式 ， ” 福斯特 说 ， 他 不是 沃尔夫 - 西蒙 研究 小组 的 一员 。	“ 这 确实 表明 ， 可能 还有 其他 形成 生命 的 方式 ， 而 不仅仅 是 生命 在 早期 地球 上 的 形成 方式 ， ” 福斯特 说 ， 他 不是 沃尔夫 - 西蒙 研究 小组 的 一员 。	[(0, 0), (1, 1), (3, 3), (5, 4), (6, 6), (7, 5), (9, 7), (10, 11), (11, 8), (13, 9), (15, 14), (18, 16), (19, 22), (20, 20), (21, 18), (22, 19), (23, 38), (24, 25), (25, 27), (26, 26), (28, 29), (30, 30), (31, 37), (32, 36), (33, 33), (34, 21), (35, 34), (36, 35), (37, 38)]
d007.s027	The research was supported by NASA , the Department of Energy and the National Institutes of Health .	这项研究得到了美国宇航局、能源部和美国国立卫生研究院的支持。	the research be support by nasa , the department_of_energy and the national_institutes_of_health .	这项 研究 得到 了 美国 宇航局 、 能源部 和 美国 国立 卫生 研究院 的 支持 。	这项 研究 得到 了 美国 宇航局 、 能源部 和 美国 国立 卫生 研究院 的 支持 。	[(1, 1), (3, 14), (6, 6), (8, 7), (9, 8), (11, 12), (12, 15)]
d008.s000	The democratic routine	民主的例行公事	the democratic routine	民主 的 例行 公事	民主 的 例行 公事	[(1, 0), (2, 2)]
d008.s001	Support for democracy in Latin America continues to edge up , as does backing for private enterprise .	拉丁美洲对民主的支持继续加强，对私营企业的支持也是如此。	support for democracy in latin_america continue to edge up , as do backing for private_enterprise .	拉丁美洲 对 民主 的 支持 继续 加强 ， 对 私营 企业 的 支持 也 是 如此 。	拉丁美洲 对 民主 的 支持 继续 加强 ， 对 私营 企业 的 支持 也 是 如此 。	[(0, 4), (1, 1), (2, 2), (3, 3), (4, 0), (5, 5), (6, 6), (10, 13), (12, 12), (13, 8), (14, 10), (15, 16)]
d008.s002	Crime has become a bigger worry than unemployment .	犯罪已成为比失业更令人担忧的问题。	crime have become a bigger worry than unemployment .	犯罪 已 成为 比 失业 更 令 人 担忧 的 问题 。	犯罪 已 成为 比 失业 更 令 人 担忧 的 问题 。	[(0, 0), (2, 2), (3, 9), (5, 8), (6, 3), (7, 4), (8, 11)]
d008.s003	And Brazil is seen as more influential than the United States across much of the region .	在该地区的大部分地区，巴西被视为比美国更具影响力。	and brazil be see as more influential than the united_states across much of the region .	在 该 地区 的 大部分 地区 ， 巴西 被 视为 比 美国 更 具 影响力 。	在 该 地区 的 大部分 地区 ， 巴西 被 视为 比 美国 更 具 影响力 。	[(1, 7), (5, 12), (7, 10), (8, 1), (9, 5), (12, 3), (13, 4), (14, 2), (15, 15)]
d008.s004	Those are some of the findings of the latest Latinobarómetro poll taken in 18 countries and published exclusively by The Economist .	这些是在18个国家进行并由《经济学人》独家出版的最新Latinobarómetro民意调查的一些结果。	those be some of the finding of the latest latinobarómetro poll take in 18 country and publish exclusively by the economist .	这些 是 在 18 个 国家 进行 并 由 《 经济 学人 》 独家 出版 的 最新 Latinobarómetro 民意 调查 的 一些 结果 。	这些 是 在 18 个 国家 进行 并 由 《 经济 学人 》 独家 出版 的 最新 Latinobarómetro 民意 调查 的 一些 结果 。	[(2, 21), (3, 15), (4, 0), (6, 20), (8, 16), (10, 19), (12, 22), (13, 3), (14, 5), (15, 7), (16, 14), (17, 13), (18, 8), (20, 11), (21, 23)]
